<?xml version="1.0" standalone="no"?>
<?xml-stylesheet type="text/css" href="catalog_20048923.css"?>


<narcuistStore xsi:noNamespaceSchemaLocation="./catalog_20048923.xsd" xmlns:xsi="http://www.w3.org/2001/XMLSchema-instance">
    <navigationBar>
            <logo id="storeLogo"></logo>
            <homePage>Home</homePage>
            <merchantsPage>Merchants</merchantsPage>
            <aboutPage>About</aboutPage>
            <contactPage>Contact</contactPage>
            <image id="searchBar"></image>
    </navigationBar>
    
    <store>
        <storeSlogan>
            <![CDATA[Send Some Instant Cheer]]>
        </storeSlogan>
        <storeDescription>
            <![CDATA[
                Celebrate special moments with the ones you love
            ]]>
        </storeDescription>
        <images>
            <image id="firstPageXboxImage"></image>
            <image id="firstPagePhysicalCardImage"></image>
            <image id="firstPagePlaystationImage"></image>
            <image id="firstPageVisaImage"></image>
        </images>
        <infoText>Discover Great Gifts</infoText>    
    </store>
    
    <rowHeading>
        <text>New Gift Cards</text>
        <arrow>
            >
            <showMore> Show More</showMore>
        </arrow>
    </rowHeading>
    
    <row id="row1">
        
        <card id="giftCard_1">
            <content giftcardid="GC01">
                <animation>
                    <name>Ebay gift card</name>
                    <manufacturer>- By Ebay</manufacturer>
                    <discount>35% DISCOUNT</discount>
                    <value currency="Dollar">$15</value>
                    <quantity>3</quantity>
                    <validTill date="AD">2023-01-01</validTill>
                    <type>Digital Gift Card</type>
                    <region range="Continent">Region :Asia</region>
                    <refundable>Refundable</refundable>
                    <status availability="true">Yes</status>
                    <users>
                        Accessable Users:
                        <li>Card Owner</li>
                        <li>All visitors</li>
                    </users>
                    <buyButton>Purchase</buyButton>
                </animation>
            </content>
        </card>
    
        <card id="giftCard_2">
            <content giftcardid="GC02">
                <animation>
                    <name>Roblox gift card</name>
                    <manufacturer>- By Roblox</manufacturer>
                    <discount>20% DISCOUNT</discount>
                    <value currency="Dollar">$30</value>
                    <quantity>20</quantity>
                    <validTill date="AD">2025-04-15</validTill>
                    <type>Digital Gift Card</type>
                    <region range="Country">Region :USA</region>
                    <refundable>Refundable</refundable>
                    <status availability="true">Yes</status>
                    <users>
                        Accessable Users:
                        <li>Card Owner</li>
                    </users>
                    <buyButton>Purchase</buyButton>
                </animation>
            </content>
        </card>
    
        <card id="giftCard_3">
            <content giftcardid="GC03">
                <animation>
                    <name>Wayfair gift card</name>
                    <manufacturer>- By CSN stores</manufacturer>
                    <discount>50% DISCOUNT</discount>
                    <value currency="NRs">NRs.5000</value>
                    <validTill date="BS">2080-12-31</validTill>
                    <region range="Country">Region :Nepal</region>
                    <refundable>Non-Refundable</refundable>
                    <status availability="false">No</status>
                    <users>
                        Accessable Users:
                        <li>Registered Users</li>
                        <li>All visitors</li>
                    </users>
                    <buyButton>Purchase</buyButton>
                </animation>
            </content>
        </card>

        <card id="giftCard_4">
            <content giftcardid="GC04">
                <animation>
                    <name>Birthday gift card</name>
                    <manufacturer>- By Panera</manufacturer>
                    <discount>75% DISCOUNT</discount>
                    <value currency="NRs">NRs.2000</value>
                    <validTill date="AD">2024-11-15</validTill>
                    <type>Physical Gift Card</type>
                    <status availability="false">No</status>
                    <users>
                        Accessable Users:
                        <li>Card Owner</li>
                        <li>Registered Users</li>
                        <li>All visitors</li>
                    </users>
                    <buyButton>Purchase</buyButton>
                </animation>
            </content>
        </card>
    </row>

    <rowHeading>
        <text>Popular Gift Cards</text>
        <arrow>
            >
            <showMore> Show More</showMore>
        </arrow>
    </rowHeading>
    
    <row id="row2">
        <card id="giftCard_5">
            <content giftcardid="GC05">
                <animation>
                    <name>VISA gift card</name>
                    <manufacturer>- By Visa</manufacturer>
                    <discount>80% DISCOUNT</discount>
                    <value currency="IRs">IRs.1000</value>
                    <quantity>15</quantity>
                    <validTill date="AD">2025-12-30</validTill>
                    <type>Digital Gift Card</type>
                    <refundable>Refundable</refundable>
                    <status availability="true">Yes</status>
                    <users>
                        Accessable Users:
                        <li>All visitors</li>
                    </users>
                    <buyButton>Purchase</buyButton>
                </animation>
            </content>
        </card>
    
        <card id="giftCard_6">
            <content giftcardid="GC06">
                <animation>
                    <name>Amazon gift card</name>
                    <manufacturer>- By Amazon</manufacturer>
                    <discount>20% DISCOUNT</discount>
                    <value currency="NRs">NRs.999</value>
                    <quantity>3</quantity>
                    <validTill date="AD">2023-01-01</validTill>
                    <type>Physical Gift Card</type>
                    <region range="Country">Region :Nepal</region>
                    <refundable>Refundable</refundable>
                    <status availability="false">No</status>
                    <users>
                        Accessable Users:
                        <li>Card Owner</li>
                        <li>Registered Users</li>
                        <li>All visitors</li>
                    </users>
                    <buyButton>Purchase</buyButton>
                </animation>
            </content>
        </card>
    
        <card id="giftCard_7">
            <content giftcardid="GC07">
                <animation>
                    <name>Nordstrom card</name>
                    <manufacturer>- By Nordstrom</manufacturer>
                    <discount>20% DISCOUNT</discount>
                    <value currency="Dollar">$10</value>
                    <quantity>2</quantity>
                    <validTill date="AD">2026-12-31</validTill>
                    <type>Physical Gift Card</type>
                    <region range="State">Region :Log Angeles</region>
                    <status availability="true">Yes</status>
                    <users>
                        Accessable Users:
                        <li>Card Owner</li>
                        <li>Registered Users</li>
                        <li>All visitors</li>
                    </users>
                    <buyButton>Purchase</buyButton>
                </animation>
            </content>
        </card>

        <card id="giftCard_8">
            <content giftcardid="GC08">
                <animation>
                    <name>Walmart gift card</name>
                    <manufacturer>- By Walmart</manufacturer>
                    <discount>100% DISCOUNT</discount>
                    <value currency="NRs">NRs.3500</value>
                    <validTill date="BS">2078-06-01</validTill>
                    <type>Digital Gift Card</type>
                    <region range="State">Region :Bagmati</region>
                    <refundable>Non-refundable</refundable>
                    <users>
                        Accessable Users:
                        <li>Registered Users</li>
                        <li>All visitors</li>
                    </users>
                    <buyButton>Purchase</buyButton>
                </animation>
            </content>
        </card>

    </row>

    <rowHeading>
        <text>Digital Gift Cards</text>
        <arrow>
            >
            <showMore> Show More</showMore>
        </arrow>
    </rowHeading>
    
    <row id="row3">
        <card id="giftCard_9">
            <content giftcardid="GC09">
                <animation>
                    <name>Google Play card</name>
                    <manufacturer>- By Google Play</manufacturer>
                    <discount>25% DISCOUNT</discount>
                    <value currency="IRs">IRs. 500</value>
                    <quantity>1</quantity>
                    <validTill date="AD">2022-07-15</validTill>
                    <type>Digital Gift Card</type>
                    <region range="Country">Region :India</region>
                    <refundable>Non-refundable</refundable>
                    <status availability="true">Yes</status>
                    <users>
                        Accessable Users:
                        <li>Card Owner</li>
                    </users>